{
  "$schema": "./theme.schema.json",
  "$comment": "Canonical theme.json reference. Copy to config/theme.json, edit for your instance, and upload to the config bucket root. Colors, radii, and fonts map to --theme-* CSS variables in ui/src/index.css; content and asset fields map to InstanceConfig in ui/src/config/instance_config.ts. Omitted keys fall back to the shipped design tokens in ui/src/index.css. One instance, one file.",

  "instance_id": "example",
  "instance_name": "Example Data Commons",
  "domain_hint": "example.data-commons.org",

  "logo": "/dc-logo.svg",
  "logo_alt": "Example Data Commons",
  "favicon": "/dc-logo.svg",

  "colors": {
    "primary": "#175C75",
    "text": "#1B1C1D",
    "text_muted": "#444746",
    "background": "#FFFFFF",
    "surface": "#F9F9F9",
    "gradient_start": "#65A782",
    "gradient_end": "#6FAEC0"
  },

  "fonts": {
    "primary": "Google Sans, system-ui, -apple-system, BlinkMacSystemFont, sans-serif",
    "body": "Google Sans Text, system-ui, -apple-system, BlinkMacSystemFont, sans-serif"
  },

  "navigation": [
    { "label": "Home", "href": "/" },
    { "label": "Data Agent", "href": "/agent" },
    { "label": "About", "href": "/about" }
  ],

  "suggestions": [
    "How has average annual wage changed over time in the United States?",
    "Compare GDP growth across G7 countries",
    "What is the gender wage gap in OECD countries?"
  ],

  "footer": {
    "text": "Example Data Commons — built on Custom Data Commons.",
    "links": [
      { "label": "About", "href": "/about" },
      { "label": "FAQ", "href": "/faq" }
    ]
  },

  "analytics": {
    "ga_tag_id": ""
  },

  "splash_assets": {},

  "metrics": {
    "$comment": "Optional Key Metrics dashboard composition. When omitted, or when tabs is empty, the Key Metrics page renders its empty state. Each tile maps 1:1 to a <datacommons-${type}> web component.",
    "tabs": [
      {
        "id": "population",
        "label": "Population",
        "tiles": [
          {
            "type": "highlight",
            "title": "World population",
            "header": "World population",
            "variable": "Count_Person",
            "place": "Earth"
          },
          {
            "type": "line",
            "title": "Population — major economies",
            "header": "Population over time",
            "variables": "Count_Person",
            "places": "country/USA country/IND country/CHN"
          },
          {
            "type": "ranking",
            "title": "Top countries by population",
            "header": "Most populous countries",
            "variable": "Count_Person",
            "parentPlace": "Earth",
            "childPlaceType": "Country",
            "rankingCount": 10
          }
        ]
      }
    ]
  }
}
